### ISSUE TITLE
GitHub webhook fails in v0.12 with 405

### ISSUE THREAD

**Issue by daniyalj** [argoproj/argo-events#431]
**Describe the bug**
Webhook from GitHub fails with 405 when invoked with example GitHub manifests.

**To Reproduce**
1. Create GitHub Gateway:

```
apiVersion: argoproj.io/v1alpha1
kind: Gateway
metadata:
  name: github-gateway
  namespace: argo-events
  labels:
    # gateway controller with instanceId "argo-events" will process this gateway
    gateways.argoproj.io/gateway-controller-instanceid: argo-events
spec:
  replica: 1
  type: "github"
  eventSourceRef:
    name: "github-event-source"
    # optional, if event source is deployed in a different namespace than the gateway
    # namespace: "other-namespace"
  processorPort: "9330"
  eventProtocol:
    type: "HTTP"
    http:
      port: "9300"
  template:
    metadata:
      name: "github-gateway"
      labels:
        gateway-name: "github-gateway"
    spec:
      containers:
        - name: "gateway-client"
          image: "argoproj/gateway-client"
          imagePullPolicy: "Always"
          command: ["/bin/gateway-client"]
        - name: "github-events"
          image: "argoproj/github-gateway"
          imagePullPolicy: "Always"
          command: ["/bin/github-gateway"]
      serviceAccountName: "argo-events-sa"
  service:
    metadata:
      name: github-gateway-svc
    spec:
      selector:
        gateway-name: "github-gateway"
      ports:
        - port: 12000
          targetPort: 12000
      type: LoadBalancer
  watchers:
    sensors:
      - name: "github-sensor"
```

2. Create GitHub Event Source:

```
# Info on GitHub Webhook: https://developer.github.com/v3/repos/hooks/#create-a-hook
apiVersion: argoproj.io/v1alpha1
kind: EventSource
metadata:
  name: github-event-source
  namespace: argo-events
spec:
  type: "github"
  github:
    example:
      namespace: argo-events
      # owner of the repo
      owner: "daniyalj"
      # repository name
      repository: "argo-events-webhook"
      # Github will send events to following port and endpoint
      webhook:
        # endpoint to listen to events on
        endpoint: "/push"
        # port to run internal HTTP server on
        port: "12000"
        # url the gateway will use to register at Github.
        # This url must be reachable from outside the cluster.
        # The gateway pod is backed by the service defined in the gateway spec. So get the URL for that service Github can reach to.
        url: "http://<external-ip-of-github-gateway-svc>"
      # type of events to listen to.
      # following listens to everything, hence *
      # You can find more info on https://developer.github.com/v3/activity/events/types/
      events:
        - "*"
      # apiToken refers to K8s secret that stores the github api token
      apiToken:
        # Name of the K8s secret that contains the access token
        name: github-access
        # Key within the K8s secret whose corresponding value (must be base64 encoded) is access token
        key: token
      # webHookSecret refers to K8s secret that stores the github hook secret
      webHookSecret:
        # Name of the K8s secret that contains the hook secret
        name: github-access
        # Key within the K8s secret whose corresponding value (must be base64 encoded) is hook secret
        key: secret
      # type of the connection between gateway and Github
      insecure: false
      # Determines if notifications are sent when the webhook is triggered
      active: true
      # The media type used to serialize the payloads
      contentType: "json"
```

3. Create GitHub Sensor:

```
apiVersion: argoproj.io/v1alpha1
kind: Sensor
metadata:
  name: github-sensor
  namespace: argo-events
  labels:
    # sensor controller with instanceId "argo-events" will process this sensor
    sensors.argoproj.io/sensor-controller-instanceid: argo-events
spec:
  template:
    spec:
      containers:
        - name: "sensor"
          image: "argoproj/sensor"
          imagePullPolicy: Always
      serviceAccountName: argo-events-sa
  dependencies:
    - name: "github-gateway:example"
  eventProtocol:
    type: "HTTP"
    http:
      port: "9300"
  triggers:
    - template:
        name: github-workflow-trigger
        group: argoproj.io
        version: v1alpha1
        resource: workflows
        source:
          resource:
            apiVersion: argoproj.io/v1alpha1
            kind: Workflow
            metadata:
              generateName: github-
            spec:
              entrypoint: whalesay
              arguments:
                parameters:
                - name: message
                  # this is the value that should be overridden
                  value: hello world
              templates:
              - name: whalesay
                inputs:
                  parameters:
                  - name: message
                container:
                  image: docker/whalesay:latest
                  command: [cowsay]
                  args: ["{{inputs.parameters.message}}"]
      resourceParameters:
        - src:
            event: "github-gateway:example"
          dest: spec.arguments.parameters.0.value
```

4. Make sure k8s secrets are in place with GitHub token.

5. Add webhook in Github with http://<external-ip>:12000/push and get 405 when invoked.

**Expected behavior**
The webhook passes and workflow in the sensor is triggered

**Screenshots**

<img width="801" alt="Screen Shot 2019-12-12 at 5 07 16 PM" src="https://user-images.githubusercontent.com/13129393/70753051-e311f880-1d01-11ea-80ce-885559594a18.png">

**Environment (please complete the following information):**
 - OS: [macOS]
 - Browser [chrome]
 - Version [v0.12]

**Additional context**
The example workflow was working in v0.11

**Comment by VaibhavPage** [comment]
Does the gateway pod log the GitHub webhook creation? And are there any other errors in the logs?

**Comment by daniyalj** [comment]
Hi @VaibhavPage the GitHub gateway pod shows the following logs. Using another repo this time. The webhook gets created but still getting a 405. This is using LB service in GKE and no additional ingress.

```
$ kubectl logs -f github-gateway-5c5fdd98b8-6p5q6 -c github-events -n argo-events
starting gateway server
INFO[2020-01-16 19:45:41] started processing the event source...        event-source=example
INFO[2020-01-16 19:45:41] validating the route...                       event-source=example
INFO[2020-01-16 19:45:41] activating the route...                       event-source=example
INFO[2020-01-16 19:45:41] activating the route...                       endpoint=/push event-source=example port=9300
INFO[2020-01-16 19:45:41] route is activated                            endpoint=/push event-source=example port=9300
INFO[2020-01-16 19:45:41] running operations post route activation...   event-source=example
INFO[2020-01-16 19:45:41] retrieving api token credentials...           event-source=example repository=dialogflow-njs
INFO[2020-01-16 19:45:41] setting up auth with api token...             event-source=example repository=dialogflow-njs
INFO[2020-01-16 19:45:41] configuring GitHub hook...                    event-source=example repository=dialogflow-njs
INFO[2020-01-16 19:45:41] retrieving webhook secret credentials...      event-source=example repository=dialogflow-njs
INFO[2020-01-16 19:45:41] setting up client for GitHub...               event-source=example repository=dialogflow-njs
INFO[2020-01-16 19:45:41] setting up base url for GitHub client...      event-source=example repository=dialogflow-njs
INFO[2020-01-16 19:45:41] setting up the upload url for GitHub client...  event-source=example repository=dialogflow-njs
INFO[2020-01-16 19:45:41] creating a GitHub hook for the repository...  event-source=example repository=dialogflow-njs
INFO[2020-01-16 19:45:41] GitHub hook has been successfully set for the repository  event-source=example repository=dialogflow-njs
INFO[2020-01-16 19:45:41] listening to payloads for the route...        event-source=example

```

**Comment by VaibhavPage** [comment]
@daniyalj looks like GitHub is not able to connect to your gateway exposed through LB. Can you post the logs of both the containers?

**Comment by arctiqtim** [comment]
Having the same issue with the newly released v0.12 images (converted everything over this morning) and new format for the configs.  GitHub seems to be able to connect fine.  A curl to the endpoint also yields a 405 ... I'm running mine through an Ingress but it's the same result in the end. @VaibhavPage

**Comment by arctiqtim** [comment]
The reason I know traffic is getting through to the gateway pod is the following:
```[tim@tim-linux argo-testing]$ curl -v https://example.com
* Rebuilt URL to: https://example.com/
*   Trying 35.203.49.120...
* TCP_NODELAY set
* Connected to example.com (35.203.49.120) port 443 (#0)
* Initializing NSS with certpath: sql:/etc/pki/nssdb
*   CAfile: none
  CApath: none
* loaded libnssckbi.so
* ALPN, server accepted to use h2
* SSL connection using TLS_ECDHE_RSA_WITH_AES_128_GCM_SHA256
* Server certificate:
* 	subject: CN=*.arctiq.ca
* 	start date: Jan 16 16:51:05 2020 GMT
* 	expire date: Apr 15 16:51:05 2020 GMT
* 	common name: *.arctiq.ca
* 	issuer: CN=Let's Encrypt Authority X3,O=Let's Encrypt,C=US
* Using HTTP2, server supports multi-use
* Connection state changed (HTTP/2 confirmed)
* Copying HTTP/2 data in stream buffer to connection buffer after upgrade: len=0
* Using Stream ID: 1 (easy handle 0x55da20a320d0)
> GET / HTTP/2
> Host: example.com
> User-Agent: curl/7.53.1
> Accept: */*
> 
* Connection state changed (MAX_CONCURRENT_STREAMS updated)!
< HTTP/2 404 
< server: nginx/1.17.7
< date: Fri, 17 Jan 2020 17:03:01 GMT
< content-type: text/plain; charset=utf-8
< content-length: 19
< x-content-type-options: nosniff
< strict-transport-security: max-age=15724800; includeSubDomains
< 
404 page not found
* Connection #0 to host example.com left intact```

Notice I get a 404 when trying to connect without the configured path from the eventsource spec.

```
[tim@tim-linux argo-testing]$ curl -v https://example.com/push
*   Trying 35.203.49.120...
* TCP_NODELAY set
* Connected to example.com (35.203.49.120) port 443 (#0)
* Initializing NSS with certpath: sql:/etc/pki/nssdb
*   CAfile: none
  CApath: none
* loaded libnssckbi.so
* ALPN, server accepted to use h2
* SSL connection using TLS_ECDHE_RSA_WITH_AES_128_GCM_SHA256
* Server certificate:
* 	subject: CN=*.arctiq.ca
* 	start date: Jan 16 16:51:05 2020 GMT
* 	expire date: Apr 15 16:51:05 2020 GMT
* 	common name: *.arctiq.ca
* 	issuer: CN=Let's Encrypt Authority X3,O=Let's Encrypt,C=US
* Using HTTP2, server supports multi-use
* Connection state changed (HTTP/2 confirmed)
* Copying HTTP/2 data in stream buffer to connection buffer after upgrade: len=0
* Using Stream ID: 1 (easy handle 0x55e89e3390d0)
> GET /push HTTP/2
> Host: example.com
> User-Agent: curl/7.53.1
> Accept: */*
> 
* Connection state changed (MAX_CONCURRENT_STREAMS updated)!
< HTTP/2 405 
< server: nginx/1.17.7
< date: Fri, 17 Jan 2020 17:03:34 GMT
< content-length: 0
< strict-transport-security: max-age=15724800; includeSubDomains
< 
* Connection #0 to host example.com left intact
```

But get a 405 when using the proper /push path configured in the eventsource

**Comment by arctiqtim** [comment]
Thought I'd add one more piece of info here.  Here is a quick tcpdump from a sidecar I loaded on the gateway ... you can see traffic hitting it on port 12000.

```22:47:16.966319 IP (tos 0x0, ttl 62, id 57623, offset 0, flags [DF], proto TCP (6), length 60)
    10.16.1.13.57606 > 10.16.2.143.12000: Flags [S], cksum 0x26b0 (correct), seq 3168579314, win 28400, options [mss 1420,sackOK,TS val 3729998018 ecr 0,nop,wscale 7], length 0
22:47:16.966355 IP (tos 0x0, ttl 64, id 0, offset 0, flags [DF], proto TCP (6), length 60)
    10.16.2.143.12000 > 10.16.1.13.57606: Flags [S.], cksum 0x17ea (incorrect -> 0x1d17), seq 3276372892, ack 3168579315, win 28160, options [mss 1420,sackOK,TS val 2398633113 ecr 3729998018,nop,wscale 7], length 0
22:47:16.966893 IP (tos 0x0, ttl 62, id 57624, offset 0, flags [DF], proto TCP (6), length 52)
    10.16.1.13.57606 > 10.16.2.143.12000: Flags [.], cksum 0xb8db (correct), ack 1, win 222, options [nop,nop,TS val 3729998020 ecr 2398633113], length 0
22:47:16.966958 IP (tos 0x0, ttl 62, id 57625, offset 0, flags [DF], proto TCP (6), length 8242)
    10.16.1.13.57606 > 10.16.2.143.12000: Flags [P.], cksum 0x37e0 (incorrect -> 0x33fc), seq 1:8191, ack 1, win 222, options [nop,nop,TS val 3729998020 ecr 2398633113], length 8190
22:47:16.966976 IP (tos 0x0, ttl 64, id 49348, offset 0, flags [DF], proto TCP (6), length 52)
    10.16.2.143.12000 > 10.16.1.13.57606: Flags [.], cksum 0x17e2 (incorrect -> 0x985f), ack 8191, win 348, options [nop,nop,TS val 2398633113 ecr 3729998020], length 0
22:47:16.967324 IP (tos 0x0, ttl 64, id 49349, offset 0, flags [DF], proto TCP (6), length 143)
    10.16.2.143.12000 > 10.16.1.13.57606: Flags [P.], cksum 0x183d (incorrect -> 0x63b9), seq 1:92, ack 8191, win 348, options [nop,nop,TS val 2398633114 ecr 3729998020], length 91
22:47:16.967451 IP (tos 0x0, ttl 62, id 57631, offset 0, flags [DF], proto TCP (6), length 52)
    10.16.1.13.57606 > 10.16.2.143.12000: Flags [.], cksum 0x9881 (correct), ack 92, win 222, options [nop,nop,TS val 3729998020 ecr 2398633114], length 0
```

**Comment by arctiqtim** [comment]
@VaibhavPage in that capture above 10.16.1.13 is my Nginx ingress controller, while 10.16.2.143 is the github gateway pod with the tcpdump sidecar with it.  I'm going to grab a more verbose capture and see if I can tell what that "incorrect" message is that the pod is sending back to GitHub (likely the 405)

**Comment by arctiqtim** [comment]
Here is a screenshot of the capture I took from the above github gw pod showing it issuing a 405 Method not Allowed back to GitHub after the webhook is received.

![image](https://user-images.githubusercontent.com/19749398/72669650-96a59100-3a02-11ea-86f3-b6462db992ed.png)

**Comment by gaetansnl** [comment]
Hello @VaibhavPage do you have any news on this ? Should we rollback to the previous version ? Thanks

**Comment by evangsea** [comment]
This issue also exists in the Slack `EventSource`. After much trial and error and building my own image from source with extra logging, I was able to solve this problem by specifying a `method` in the `webhook` context of the `EventSource` manifest, like so:

```
apiVersion: argoproj.io/v1alpha1
kind: EventSource
metadata:
  name: slack-event-source
spec:
  type: "slack"
  slack:
    example-insecure:
      namespace: argo-events
      webhook:
        endpoint: "/slack-endpoint"
        port: "12000"
        method: "post" # <---- here
```
The example EventSource manifests should be updated to include that at a minimum; however, since GitHub Webhooks and Slack interactions will always POST against the service endpoint, it might make sense to address that in the Slack and GitHub-specific Gateway event images.
